903120281.664066 8:0:20:85:af:9e 0:0:c:76:3d:c7 ip 58: 132.235.3.128.34552 > 132.235.1.2.finger: S 2089459361:2089459361(0) win 9282 <mss 1326> (DF)
903120281.665896 0:0:c:76:3d:c7 8:0:20:85:af:9e ip 60: 132.235.1.2.finger > 132.235.3.128.34552: S 1981888000:1981888000(0) ack 2089459362 win 4096 <mss 1460>
903120281.665975 8:0:20:85:af:9e 0:0:c:76:3d:c7 ip 54: 132.235.3.128.34552 > 132.235.1.2.finger: . ack 1 win 9282 (DF)
903120281.667295 8:0:20:85:af:9e 0:0:c:76:3d:c7 ip 56: 132.235.3.128.34552 > 132.235.1.2.finger: P 1:3(2) ack 1 win 9282 (DF)
903120281.785964 0:0:c:76:3d:c7 8:0:20:85:af:9e ip 60: 132.235.1.2.finger > 132.235.3.128.34552: . ack 3 win 4094
903120281.801142 0:0:c:76:3d:c7 8:0:20:85:af:9e ip 78: 132.235.1.2.finger > 132.235.3.128.34552: P 1:25(24) ack 3 win 4096
903120281.801824 0:0:c:76:3d:c7 8:0:20:85:af:9e ip 60: 132.235.1.2.finger > 132.235.3.128.34552: F 25:25(0) ack 3 win 4096
903120281.802015 8:0:20:85:af:9e 0:0:c:76:3d:c7 ip 54: 132.235.3.128.34552 > 132.235.1.2.finger: . ack 26 win 9282 (DF)
903120281.804710 8:0:20:85:af:9e 0:0:c:76:3d:c7 ip 54: 132.235.3.128.34552 > 132.235.1.2.finger: F 3:3(0) ack 26 win 9282 (DF)
903120281.807920 0:0:c:76:3d:c7 8:0:20:85:af:9e ip 60: 132.235.1.2.finger > 132.235.3.128.34552: . ack 4 win 4096
903120282.951344 8:0:20:85:af:9e 0:0:c:76:3d:c7 ip 58: 132.235.3.128.34553 > 132.235.1.2.finger: S 2089745236:2089745236(0) win 9282 <mss 1326> (DF)
903120282.953150 0:0:c:76:3d:c7 8:0:20:85:af:9e ip 60: 132.235.1.2.finger > 132.235.3.128.34553: S 1982080000:1982080000(0) ack 2089745237 win 4096 <mss 1460>
903120282.953213 8:0:20:85:af:9e 0:0:c:76:3d:c7 ip 54: 132.235.3.128.34553 > 132.235.1.2.finger: . ack 1 win 9282 (DF)
903120282.954522 8:0:20:85:af:9e 0:0:c:76:3d:c7 ip 56: 132.235.3.128.34553 > 132.235.1.2.finger: P 1:3(2) ack 1 win 9282 (DF)
903120282.986517 0:0:c:76:3d:c7 8:0:20:85:af:9e ip 60: 132.235.1.2.finger > 132.235.3.128.34553: . ack 3 win 4094
903120283.084037 0:0:c:76:3d:c7 8:0:20:85:af:9e ip 78: 132.235.1.2.finger > 132.235.3.128.34553: P 1:25(24) ack 3 win 4096
903120283.084433 0:0:c:76:3d:c7 8:0:20:85:af:9e ip 60: 132.235.1.2.finger > 132.235.3.128.34553: F 25:25(0) ack 3 win 4096
903120283.084529 8:0:20:85:af:9e 0:0:c:76:3d:c7 ip 54: 132.235.3.128.34553 > 132.235.1.2.finger: . ack 26 win 9282 (DF)
903120283.088845 8:0:20:85:af:9e 0:0:c:76:3d:c7 ip 54: 132.235.3.128.34553 > 132.235.1.2.finger: F 3:3(0) ack 26 win 9282 (DF)
903120283.090304 0:0:c:76:3d:c7 8:0:20:85:af:9e ip 60: 132.235.1.2.finger > 132.235.3.128.34553: . ack 4 win 4096
