21:49:51.4294804694 50.144.16.71.1035 > 10.221.22.52.1521: S 2456338095:2456338095(0) win 65535 <mss 1460,nop,nop,sackOK> (DF)
21:49:51.4294840339 10.221.22.52.1521 > 50.144.16.71.1035: S 902489989:902489989(0) ack 2456338096 win 32768 <mss 1460,nop,nop,sackOK> (DF)
21:49:51.4294840819 50.144.16.71.1035 > 10.221.22.52.1521: . ack 1 win 65535 (DF)
21:49:51.4294845227 50.144.16.71.1035 > 10.221.22.52.1521: P 1:239(238) ack 1 win 65535 (DF)
21:49:51.4294888594 10.221.22.52.1521 > 50.144.16.71.1035: . ack 239 win 32768 (DF)
21:49:51.4294889581 10.221.22.52.1521 > 50.144.16.71.1035: P 1:9(8) ack 239 win 32768 (DF)
21:49:51.4294889944 50.144.16.71.1035 > 10.221.22.52.1521: P 239:477(238) ack 9 win 65527 (DF)
21:49:51.4294904330 10.221.22.52.1521 > 50.144.16.71.1035: P 9:41(32) ack 477 win 32768 (DF)
21:49:51.4294904750 50.144.16.71.1035 > 10.221.22.52.1521: P 477:644(167) ack 41 win 65495 (DF)
21:49:51.4294909200 10.221.22.52.1521 > 50.144.16.71.1035: P 41:168(127) ack 644 win 32768 (DF)
21:49:51.4294914741 50.144.16.71.1035 > 10.221.22.52.1521: P 644:681(37) ack 168 win 65368 (DF)
21:49:51.4294919622 10.221.22.52.1521 > 50.144.16.71.1035: P 168:316(148) ack 681 win 32768 (DF)
21:49:51.4294928597 50.144.16.71.1035 > 10.221.22.52.1521: P 681:1649(968) ack 316 win 65220 (DF)
21:49:51.4294934997 10.221.22.52.1521 > 50.144.16.71.1035: P 316:1221(905) ack 1649 win 32768 (DF)
21:49:51.4294935678 50.144.16.71.1035 > 10.221.22.52.1521: P 1649:1763(114) ack 1221 win 64315 (DF)
21:49:51.4294943808 10.221.22.52.1521 > 50.144.16.71.1035: P 1221:1277(56) ack 1763 win 32768 (DF)
21:49:51.4294948808 50.144.16.71.1035 > 10.221.22.52.1521: P 1763:1894(131) ack 1277 win 64259 (DF)
21:49:51.4294954052 10.221.22.52.1521 > 50.144.16.71.1035: P 1277:1314(37) ack 1894 win 32768 (DF)
21:49:51.4294954437 50.144.16.71.1035 > 10.221.22.52.1521: P 1894:1912(18) ack 1314 win 64222 (DF)
21:49:51.4294959061 10.221.22.52.1521 > 50.144.16.71.1035: P 1314:1334(20) ack 1912 win 32768 (DF)
21:49:51.4294961595 50.144.16.71.1035 > 10.221.22.52.1521: P 1912:1927(15) ack 1334 win 64202 (DF)
21:49:51.4294966347 10.221.22.52.1521 > 50.144.16.71.1035: P 1334:1348(14) ack 1927 win 32768 (DF)
21:49:52.4293975161 50.144.16.71.1035 > 10.221.22.52.1521: P 1927:2204(277) ack 1348 win 64188 (DF)
21:49:52.4293979965 10.221.22.52.1521 > 50.144.16.71.1035: P 1348:1387(39) ack 2204 win 32768 (DF)
21:49:52.4293982166 50.144.16.71.1035 > 10.221.22.52.1521: P 2204:2219(15) ack 1387 win 64149 (DF)
21:49:52.4293987276 10.221.22.52.1521 > 50.144.16.71.1035: P 1387:1398(11) ack 2219 win 32768 (DF)
21:49:52.4293987844 50.144.16.71.1035 > 10.221.22.52.1521: P 2219:2232(13) ack 1398 win 64138 (DF)
21:49:52.4293992095 10.221.22.52.1521 > 50.144.16.71.1035: P 1398:1409(11) ack 2232 win 32768 (DF)
21:49:52.4293992395 50.144.16.71.1035 > 10.221.22.52.1521: P 2232:2247(15) ack 1409 win 64127 (DF)
21:49:52.4293997295 10.221.22.52.1521 > 50.144.16.71.1035: P 1409:1423(14) ack 2247 win 32768 (DF)
21:49:52.4293997736 50.144.16.71.1035 > 10.221.22.52.1521: P 2247:2427(180) ack 1423 win 64113 (DF)
21:49:52.4294002830 10.221.22.52.1521 > 50.144.16.71.1035: P 1423:1463(40) ack 2427 win 32768 (DF)
21:49:52.4294008733 50.144.16.71.1035 > 10.221.22.52.1521: P 2427:2507(80) ack 1463 win 65535 (DF)
21:49:52.4294014227 10.221.22.52.1521 > 50.144.16.71.1035: P 1463:1611(148) ack 2507 win 32768 (DF)
21:49:52.4294018333 50.144.16.71.1035 > 10.221.22.52.1521: P 2507:2522(15) ack 1611 win 65387 (DF)
21:49:52.4294023501 10.221.22.52.1521 > 50.144.16.71.1035: P 1611:1622(11) ack 2522 win 32768 (DF)
21:49:52.4294038647 50.144.16.71.1035 > 10.221.22.52.1521: P 2522:2537(15) ack 1622 win 65376 (DF)
21:49:52.4294042910 10.221.22.52.1521 > 50.144.16.71.1035: P 1622:1636(14) ack 2537 win 32768 (DF)
21:49:52.4294045358 50.144.16.71.1035 > 10.221.22.52.1521: P 2537:2652(115) ack 1636 win 65362 (DF)
21:49:52.4294050465 10.221.22.52.1521 > 50.144.16.71.1035: P 1636:1677(41) ack 2652 win 32768 (DF)
21:49:52.4294050856 50.144.16.71.1035 > 10.221.22.52.1521: P 2652:2679(27) ack 1677 win 65321 (DF)
21:49:52.4294056024 10.221.22.52.1521 > 50.144.16.71.1035: P 1677:1848(171) ack 2679 win 32768 (DF)
21:49:52.4294056374 50.144.16.71.1035 > 10.221.22.52.1521: P 2679:2697(18) ack 1848 win 65150 (DF)
21:49:52.4294061532 10.221.22.52.1521 > 50.144.16.71.1035: P 1848:1887(39) ack 2697 win 32768 (DF)
21:49:52.4294078608 50.144.16.71.1035 > 10.221.22.52.1521: P 2697:2818(121) ack 1887 win 65111 (DF)
21:49:52.4294084696 10.221.22.52.1521 > 50.144.16.71.1035: P 1887:3347(1460) ack 2818 win 32768 (DF)
21:49:52.4294084731 10.221.22.52.1521 > 50.144.16.71.1035: P 3347:3926(579) ack 2818 win 32768 (DF)
21:49:52.4294085020 10.221.22.52.1521 > 50.144.16.71.1035: P 3926:4789(863) ack 2818 win 32768 (DF)
21:49:52.4294085298 50.144.16.71.1035 > 10.221.22.52.1521: . ack 3926 win 65535 (DF)
21:49:52.4294143531 50.144.16.71.1035 > 10.221.22.52.1521: . ack 4789 win 64672 (DF)
21:49:52.4294445914 50.144.16.71.1035 > 10.221.22.52.1521: P 2818:2833(15) ack 4789 win 64672 (DF)
21:49:52.4294451315 10.221.22.52.1521 > 50.144.16.71.1035: P 4789:4800(11) ack 2833 win 32768 (DF)
21:49:52.4294451854 50.144.16.71.1035 > 10.221.22.52.1521: P 2833:2848(15) ack 4800 win 64661 (DF)
21:49:52.4294456852 10.221.22.52.1521 > 50.144.16.71.1035: P 4800:4814(14) ack 2848 win 32768 (DF)
21:49:52.4294457282 50.144.16.71.1035 > 10.221.22.52.1521: P 2848:2938(90) ack 4814 win 64647 (DF)
21:49:52.4294461692 10.221.22.52.1521 > 50.144.16.71.1035: P 4814:4855(41) ack 2938 win 32768 (DF)
21:49:52.4294462021 50.144.16.71.1035 > 10.221.22.52.1521: P 2938:2965(27) ack 4855 win 64606 (DF)
21:49:52.4294466523 10.221.22.52.1521 > 50.144.16.71.1035: P 4855:4949(94) ack 2965 win 32768 (DF)
21:49:52.4294466852 50.144.16.71.1035 > 10.221.22.52.1521: P 2965:2983(18) ack 4949 win 64512 (DF)
21:49:52.4294471590 10.221.22.52.1521 > 50.144.16.71.1035: P 4949:4988(39) ack 2983 win 32768 (DF)
21:49:52.4294472113 50.144.16.71.1035 > 10.221.22.52.1521: P 2983:3065(82) ack 4988 win 64473 (DF)
21:49:52.4294478014 10.221.22.52.1521 > 50.144.16.71.1035: P 4988:5248(260) ack 3065 win 32768 (DF)
21:49:52.4294525466 50.144.16.71.1035 > 10.221.22.52.1521: . ack 5248 win 64213 (DF)
21:49:52.4294877919 50.144.16.71.1035 > 10.221.22.52.1521: P 3065:3080(15) ack 5248 win 64213 (DF)
21:49:52.4294885275 10.221.22.52.1521 > 50.144.16.71.1035: P 5248:5259(11) ack 3080 win 32768 (DF)
21:49:52.4294891061 50.144.16.71.1035 > 10.221.22.52.1521: P 3080:3093(13) ack 5259 win 64202 (DF)
21:49:52.4294896429 10.221.22.52.1521 > 50.144.16.71.1035: P 5259:5270(11) ack 3093 win 32768 (DF)
21:49:52.4294896904 50.144.16.71.1035 > 10.221.22.52.1521: P 3093:3103(10) ack 5270 win 64191 (DF)
21:49:52.4294896906 50.144.16.71.1035 > 10.221.22.52.1521: F 3103:3103(0) ack 5270 win 64191 (DF)
21:49:52.4294902021 10.221.22.52.1521 > 50.144.16.71.1035: . ack 3104 win 32768 (DF)
21:49:52.4294902024 10.221.22.52.1521 > 50.144.16.71.1035: F 5270:5270(0) ack 3104 win 0 (DF)
21:49:52.4294902502 50.144.16.71.1035 > 10.221.22.52.1521: . ack 5271 win 64191 (DF)
21:53:30.4294138731 50.144.16.71.1038 > 10.221.22.52.ftp: S 2599318749:2599318749(0) win 65535 <mss 1460,nop,nop,sackOK> (DF)
21:53:30.4294143060 10.221.22.52.ftp > 50.144.16.71.1038: S 1057907173:1057907173(0) ack 2599318750 win 32768 <mss 1460,nop,nop,sackOK> (DF)
21:53:30.4294143391 50.144.16.71.1038 > 10.221.22.52.ftp: . ack 1 win 65535 (DF)
21:53:30.4294156040 10.221.22.52.ftp > 50.144.16.71.1038: P 1:92(91) ack 1 win 32768 (DF) [tos 0x10] 
21:53:30.4294156392 50.144.16.71.1038 > 10.221.22.52.ftp: P 1:13(12) ack 92 win 65444 (DF)
21:53:30.4294165393 10.221.22.52.ftp > 50.144.16.71.1038: P 92:126(34) ack 13 win 32768 (DF) [tos 0x10] 
21:53:30.4294165711 50.144.16.71.1038 > 10.221.22.52.ftp: P 13:28(15) ack 126 win 65410 (DF)
21:53:30.4294190459 10.221.22.52.ftp > 50.144.16.71.1038: . ack 28 win 32768 (DF) [tos 0x10] 
21:53:30.4294208556 10.221.22.52.ftp > 50.144.16.71.1038: P 126:153(27) ack 28 win 32768 (DF) [tos 0x10] 
21:53:30.4294270213 50.144.16.71.1038 > 10.221.22.52.ftp: . ack 153 win 65383 (DF)
21:53:30.4294329178 50.144.16.71.1038 > 10.221.22.52.ftp: P 28:33(5) ack 153 win 65383 (DF)
21:53:30.4294333941 10.221.22.52.ftp > 50.144.16.71.1038: P 153:208(55) ack 33 win 32768 (DF) [tos 0x10] 
21:53:30.4294334298 50.144.16.71.1038 > 10.221.22.52.ftp: P 33:82(49) ack 208 win 65328 (DF)
21:53:30.4294338771 10.221.22.52.ftp > 50.144.16.71.1038: P 208:237(29) ack 82 win 32768 (DF) [tos 0x10] 
21:53:30.4294339101 50.144.16.71.1038 > 10.221.22.52.ftp: P 82:90(8) ack 237 win 65299 (DF)
21:53:30.4294343232 10.221.22.52.ftp > 50.144.16.71.1038: P 237:257(20) ack 90 win 32768 (DF) [tos 0x10] 
21:53:30.4294343605 50.144.16.71.1038 > 10.221.22.52.ftp: P 90:114(24) ack 257 win 65279 (DF)
21:53:30.4294348534 10.221.22.52.ftp > 50.144.16.71.1038: P 257:287(30) ack 114 win 32768 (DF) [tos 0x10] 
21:53:30.4294348827 50.144.16.71.1038 > 10.221.22.52.ftp: P 114:143(29) ack 287 win 65249 (DF)
21:53:30.4294357115 10.221.22.52.ftp-data > 50.144.16.71.1039: S 1058194777:1058194777(0) win 57344 <mss 1460,wscale 0,nop> (DF) [tos 0x8] 
21:53:30.4294357403 50.144.16.71.1039 > 10.221.22.52.ftp-data: S 2599528181:2599528181(0) ack 1058194778 win 65535 <mss 1460,nop,wscale 0> (DF)
21:53:30.4294361659 10.221.22.52.ftp > 50.144.16.71.1038: P 287:356(69) ack 143 win 32768 (DF) [tos 0x10] 
21:53:30.4294368615 10.221.22.52.ftp-data > 50.144.16.71.1039: . ack 1 win 57344 (DF) [tos 0x8] 
21:53:30.4294369353 50.144.16.71.1039 > 10.221.22.52.ftp-data: . 1:1461(1460) ack 1 win 65535 (DF)
21:53:30.4294369399 50.144.16.71.1039 > 10.221.22.52.ftp-data: . 1461:2921(1460) ack 1 win 65535 (DF)
21:53:30.4294374522 10.221.22.52.ftp-data > 50.144.16.71.1039: . ack 1461 win 57344 (DF) [tos 0x8] 
21:53:30.4294375155 50.144.16.71.1039 > 10.221.22.52.ftp-data: P 2921:4381(1460) ack 1 win 65535 (DF)
21:53:30.4294375198 50.144.16.71.1039 > 10.221.22.52.ftp-data: . 4381:5841(1460) ack 1 win 65535 (DF)
21:53:30.4294380985 10.221.22.52.ftp-data > 50.144.16.71.1039: . ack 4381 win 57344 (DF) [tos 0x8] 
21:53:30.4294381615 50.144.16.71.1039 > 10.221.22.52.ftp-data: . 5841:7301(1460) ack 1 win 65535 (DF)
21:53:30.4294381658 50.144.16.71.1039 > 10.221.22.52.ftp-data: P 7301:8761(1460) ack 1 win 65535 (DF)
21:53:30.4294381705 50.144.16.71.1039 > 10.221.22.52.ftp-data: . 8761:10221(1460) ack 1 win 65535 (DF)
21:53:30.4294387685 10.221.22.52.ftp-data > 50.144.16.71.1039: . ack 8761 win 57344 (DF) [tos 0x8] 
21:53:30.4294388322 50.144.16.71.1039 > 10.221.22.52.ftp-data: . 10221:11681(1460) ack 1 win 65535 (DF)
21:53:30.4294388365 50.144.16.71.1039 > 10.221.22.52.ftp-data: P 11681:13141(1460) ack 1 win 65535 (DF)
21:53:30.4294388408 50.144.16.71.1039 > 10.221.22.52.ftp-data: . 13141:14601(1460) ack 1 win 65535 (DF)
21:53:30.4294388451 50.144.16.71.1039 > 10.221.22.52.ftp-data: . 14601:16061(1460) ack 1 win 65535 (DF)
21:53:30.4294394551 10.221.22.52.ftp-data > 50.144.16.71.1039: . ack 14601 win 57344 (DF) [tos 0x8] 
21:53:30.4294395193 50.144.16.71.1039 > 10.221.22.52.ftp-data: P 16061:17521(1460) ack 1 win 65535 (DF)
21:53:30.4294395249 50.144.16.71.1039 > 10.221.22.52.ftp-data: . 17521:18981(1460) ack 1 win 65535 (DF)
21:53:30.4294395314 50.144.16.71.1039 > 10.221.22.52.ftp-data: . 18981:20441(1460) ack 1 win 65535 (DF)
21:53:30.4294395317 50.144.16.71.1039 > 10.221.22.52.ftp-data: P 20441:20481(40) ack 1 win 65535 (DF)
21:53:30.4294395360 50.144.16.71.1039 > 10.221.22.52.ftp-data: . 20481:21941(1460) ack 1 win 65535 (DF)
21:53:30.4294402410 10.221.22.52.ftp-data > 50.144.16.71.1039: . ack 21941 win 57344 (DF) [tos 0x8] 
21:53:30.4294403019 50.144.16.71.1039 > 10.221.22.52.ftp-data: . 21941:23401(1460) ack 1 win 65535 (DF)
21:53:30.4294403054 50.144.16.71.1039 > 10.221.22.52.ftp-data: P 23401:24577(1176) ack 1 win 65535 (DF)
21:53:30.4294403097 50.144.16.71.1039 > 10.221.22.52.ftp-data: . 24577:26037(1460) ack 1 win 65535 (DF)
21:53:30.4294403142 50.144.16.71.1039 > 10.221.22.52.ftp-data: . 26037:27497(1460) ack 1 win 65535 (DF)
21:53:30.4294403177 50.144.16.71.1039 > 10.221.22.52.ftp-data: P 27497:28673(1176) ack 1 win 65535 (DF)
21:53:30.4294403220 50.144.16.71.1039 > 10.221.22.52.ftp-data: . 28673:30133(1460) ack 1 win 65535 (DF)
21:53:30.4294403263 50.144.16.71.1039 > 10.221.22.52.ftp-data: . 30133:31593(1460) ack 1 win 65535 (DF)
21:53:30.4294410371 10.221.22.52.ftp-data > 50.144.16.71.1039: . ack 28673 win 57344 (DF) [tos 0x8] 
21:53:30.4294410995 50.144.16.71.1039 > 10.221.22.52.ftp-data: P 31593:32769(1176) ack 1 win 65535 (DF)
21:53:30.4294411108 50.144.16.71.1039 > 10.221.22.52.ftp-data: . 32769:34229(1460) ack 1 win 65535 (DF)
21:53:30.4294411158 50.144.16.71.1039 > 10.221.22.52.ftp-data: . 34229:35689(1460) ack 1 win 65535 (DF)
21:53:30.4294411193 50.144.16.71.1039 > 10.221.22.52.ftp-data: P 35689:36865(1176) ack 1 win 65535 (DF)
21:53:30.4294411239 50.144.16.71.1039 > 10.221.22.52.ftp-data: . 36865:38325(1460) ack 1 win 65535 (DF)
21:53:30.4294411283 50.144.16.71.1039 > 10.221.22.52.ftp-data: . 38325:39785(1460) ack 1 win 65535 (DF)
21:53:30.4294417550 10.221.22.52.ftp-data > 50.144.16.71.1039: . ack 36865 win 57344 (DF) [tos 0x8] 
21:53:30.4294418139 50.144.16.71.1039 > 10.221.22.52.ftp-data: P 39785:40961(1176) ack 1 win 65535 (DF)
21:53:30.4294418220 50.144.16.71.1039 > 10.221.22.52.ftp-data: . 40961:42421(1460) ack 1 win 65535 (DF)
21:53:30.4294418288 50.144.16.71.1039 > 10.221.22.52.ftp-data: . 42421:43881(1460) ack 1 win 65535 (DF)
21:53:30.4294418327 50.144.16.71.1039 > 10.221.22.52.ftp-data: P 43881:45057(1176) ack 1 win 65535 (DF)
21:53:30.4294418370 50.144.16.71.1039 > 10.221.22.52.ftp-data: . 45057:46517(1460) ack 1 win 65535 (DF)
21:53:30.4294418413 50.144.16.71.1039 > 10.221.22.52.ftp-data: . 46517:47977(1460) ack 1 win 65535 (DF)
21:53:30.4294418448 50.144.16.71.1039 > 10.221.22.52.ftp-data: P 47977:49153(1176) ack 1 win 65535 (DF)
21:53:30.4294422949 50.144.16.71.1038 > 10.221.22.52.ftp: . ack 356 win 65180 (DF)
21:53:30.4294424774 10.221.22.52.ftp-data > 50.144.16.71.1039: . ack 45057 win 57344 (DF) [tos 0x8] 
21:53:30.4294425413 50.144.16.71.1039 > 10.221.22.52.ftp-data: . 49153:50613(1460) ack 1 win 65535 (DF)
21:53:30.4294425489 50.144.16.71.1039 > 10.221.22.52.ftp-data: . 50613:52073(1460) ack 1 win 65535 (DF)
21:53:30.4294425524 50.144.16.71.1039 > 10.221.22.52.ftp-data: P 52073:53249(1176) ack 1 win 65535 (DF)
21:53:30.4294425573 50.144.16.71.1039 > 10.221.22.52.ftp-data: . 53249:54709(1460) ack 1 win 65535 (DF)
21:53:30.4294425616 50.144.16.71.1039 > 10.221.22.52.ftp-data: . 54709:56169(1460) ack 1 win 65535 (DF)
21:53:30.4294425651 50.144.16.71.1039 > 10.221.22.52.ftp-data: P 56169:57345(1176) ack 1 win 65535 (DF)
21:53:30.4294431510 10.221.22.52.ftp-data > 50.144.16.71.1039: . ack 53249 win 57344 (DF) [tos 0x8] 
21:53:30.4294432144 50.144.16.71.1039 > 10.221.22.52.ftp-data: . 57345:58805(1460) ack 1 win 65535 (DF)
21:53:30.4294432198 50.144.16.71.1039 > 10.221.22.52.ftp-data: . 58805:60265(1460) ack 1 win 65535 (DF)
21:53:30.4294432233 50.144.16.71.1039 > 10.221.22.52.ftp-data: P 60265:61441(1176) ack 1 win 65535 (DF)
21:53:30.4294432276 50.144.16.71.1039 > 10.221.22.52.ftp-data: . 61441:62901(1460) ack 1 win 65535 (DF)
21:53:30.4294432319 50.144.16.71.1039 > 10.221.22.52.ftp-data: . 62901:64361(1460) ack 1 win 65535 (DF)
21:53:30.4294432354 50.144.16.71.1039 > 10.221.22.52.ftp-data: P 64361:65537(1176) ack 1 win 65535 (DF)
21:53:30.4294438275 10.221.22.52.ftp-data > 50.144.16.71.1039: . ack 61441 win 57344 (DF) [tos 0x8] 
21:53:30.4294438956 50.144.16.71.1039 > 10.221.22.52.ftp-data: . 65537:66997(1460) ack 1 win 65535 (DF)
21:53:30.4294439002 50.144.16.71.1039 > 10.221.22.52.ftp-data: . 66997:68457(1460) ack 1 win 65535 (DF)
21:53:30.4294439036 50.144.16.71.1039 > 10.221.22.52.ftp-data: P 68457:69633(1176) ack 1 win 65535 (DF)
21:53:30.4294439079 50.144.16.71.1039 > 10.221.22.52.ftp-data: . 69633:71093(1460) ack 1 win 65535 (DF)
21:53:30.4294439122 50.144.16.71.1039 > 10.221.22.52.ftp-data: . 71093:72553(1460) ack 1 win 65535 (DF)
21:53:30.4294439157 50.144.16.71.1039 > 10.221.22.52.ftp-data: P 72553:73729(1176) ack 1 win 65535 (DF)
21:53:30.4294445075 10.221.22.52.ftp-data > 50.144.16.71.1039: . ack 69633 win 57344 (DF) [tos 0x8] 
21:53:30.4294445741 50.144.16.71.1039 > 10.221.22.52.ftp-data: . 73729:75189(1460) ack 1 win 65535 (DF)
21:53:30.4294445788 50.144.16.71.1039 > 10.221.22.52.ftp-data: . 75189:76649(1460) ack 1 win 65535 (DF)
21:53:30.4294445823 50.144.16.71.1039 > 10.221.22.52.ftp-data: P 76649:77825(1176) ack 1 win 65535 (DF)
21:53:30.4294445866 50.144.16.71.1039 > 10.221.22.52.ftp-data: . 77825:79285(1460) ack 1 win 65535 (DF)
21:53:30.4294445909 50.144.16.71.1039 > 10.221.22.52.ftp-data: . 79285:80745(1460) ack 1 win 65535 (DF)
21:53:30.4294445944 50.144.16.71.1039 > 10.221.22.52.ftp-data: P 80745:81921(1176) ack 1 win 65535 (DF)
21:53:30.4294451887 10.221.22.52.ftp-data > 50.144.16.71.1039: . ack 77825 win 57344 (DF) [tos 0x8] 
21:53:30.4294452552 50.144.16.71.1039 > 10.221.22.52.ftp-data: . 81921:83381(1460) ack 1 win 65535 (DF)
21:53:30.4294452595 50.144.16.71.1039 > 10.221.22.52.ftp-data: . 83381:84841(1460) ack 1 win 65535 (DF)
21:53:30.4294452650 50.144.16.71.1039 > 10.221.22.52.ftp-data: P 84841:86017(1176) ack 1 win 65535 (DF)
21:53:30.4294452701 50.144.16.71.1039 > 10.221.22.52.ftp-data: . 86017:87477(1460) ack 1 win 65535 (DF)
21:53:30.4294452770 50.144.16.71.1039 > 10.221.22.52.ftp-data: . 87477:88937(1460) ack 1 win 65535 (DF)
21:53:30.4294452805 50.144.16.71.1039 > 10.221.22.52.ftp-data: P 88937:90113(1176) ack 1 win 65535 (DF)
21:53:30.4294458686 10.221.22.52.ftp-data > 50.144.16.71.1039: . ack 86017 win 57344 (DF) [tos 0x8] 
21:53:30.4294459320 50.144.16.71.1039 > 10.221.22.52.ftp-data: . 90113:91573(1460) ack 1 win 65535 (DF)
21:53:30.4294459369 50.144.16.71.1039 > 10.221.22.52.ftp-data: . 91573:93033(1460) ack 1 win 65535 (DF)
21:53:30.4294459404 50.144.16.71.1039 > 10.221.22.52.ftp-data: P 93033:94209(1176) ack 1 win 65535 (DF)
21:53:30.4294459447 50.144.16.71.1039 > 10.221.22.52.ftp-data: . 94209:95669(1460) ack 1 win 65535 (DF)
21:53:30.4294459492 50.144.16.71.1039 > 10.221.22.52.ftp-data: . 95669:97129(1460) ack 1 win 65535 (DF)
21:53:30.4294459527 50.144.16.71.1039 > 10.221.22.52.ftp-data: P 97129:98305(1176) ack 1 win 65535 (DF)
21:53:30.4294466157 10.221.22.52.ftp-data > 50.144.16.71.1039: . ack 94209 win 57344 (DF) [tos 0x8] 
21:53:30.4294466881 50.144.16.71.1039 > 10.221.22.52.ftp-data: . 98305:99765(1460) ack 1 win 65535 (DF)
21:53:30.4294466936 50.144.16.71.1039 > 10.221.22.52.ftp-data: . 99765:101225(1460) ack 1 win 65535 (DF)
21:53:30.4294467002 50.144.16.71.1039 > 10.221.22.52.ftp-data: P 101225:102401(1176) ack 1 win 65535 (DF)
21:53:30.4294467045 50.144.16.71.1039 > 10.221.22.52.ftp-data: . 102401:103861(1460) ack 1 win 65535 (DF)
21:53:30.4294467088 50.144.16.71.1039 > 10.221.22.52.ftp-data: . 103861:105321(1460) ack 1 win 65535 (DF)
21:53:30.4294467125 50.144.16.71.1039 > 10.221.22.52.ftp-data: P 105321:106497(1176) ack 1 win 65535 (DF)
21:53:30.4294473655 10.221.22.52.ftp-data > 50.144.16.71.1039: . ack 102401 win 57344 (DF) [tos 0x8] 
21:53:30.4294474524 50.144.16.71.1039 > 10.221.22.52.ftp-data: . 106497:107957(1460) ack 1 win 65535 (DF)
21:53:30.4294474577 50.144.16.71.1039 > 10.221.22.52.ftp-data: . 107957:109417(1460) ack 1 win 65535 (DF)
21:53:30.4294474613 50.144.16.71.1039 > 10.221.22.52.ftp-data: P 109417:110593(1176) ack 1 win 65535 (DF)
21:53:30.4294474655 50.144.16.71.1039 > 10.221.22.52.ftp-data: . 110593:112053(1460) ack 1 win 65535 (DF)
21:53:30.4294474699 50.144.16.71.1039 > 10.221.22.52.ftp-data: . 112053:113513(1460) ack 1 win 65535 (DF)
21:53:30.4294474733 50.144.16.71.1039 > 10.221.22.52.ftp-data: P 113513:114689(1176) ack 1 win 65535 (DF)
21:53:30.4294480669 10.221.22.52.ftp-data > 50.144.16.71.1039: . ack 110593 win 57344 (DF) [tos 0x8] 
21:53:30.4294481325 50.144.16.71.1039 > 10.221.22.52.ftp-data: . 114689:116149(1460) ack 1 win 65535 (DF)
21:53:30.4294481367 50.144.16.71.1039 > 10.221.22.52.ftp-data: . 116149:117609(1460) ack 1 win 65535 (DF)
21:53:30.4294481403 50.144.16.71.1039 > 10.221.22.52.ftp-data: P 117609:118785(1176) ack 1 win 65535 (DF)
21:53:30.4294481445 50.144.16.71.1039 > 10.221.22.52.ftp-data: . 118785:120245(1460) ack 1 win 65535 (DF)
21:53:30.4294481488 50.144.16.71.1039 > 10.221.22.52.ftp-data: . 120245:121705(1460) ack 1 win 65535 (DF)
21:53:30.4294481523 50.144.16.71.1039 > 10.221.22.52.ftp-data: P 121705:122881(1176) ack 1 win 65535 (DF)
21:53:30.4294487464 10.221.22.52.ftp-data > 50.144.16.71.1039: . ack 118785 win 57344 (DF) [tos 0x8] 
21:53:30.4294488230 50.144.16.71.1039 > 10.221.22.52.ftp-data: . 122881:124341(1460) ack 1 win 65535 (DF)
21:53:30.4294488311 50.144.16.71.1039 > 10.221.22.52.ftp-data: . 124341:125801(1460) ack 1 win 65535 (DF)
21:53:30.4294488347 50.144.16.71.1039 > 10.221.22.52.ftp-data: P 125801:126977(1176) ack 1 win 65535 (DF)
21:53:30.4294488389 50.144.16.71.1039 > 10.221.22.52.ftp-data: . 126977:128437(1460) ack 1 win 65535 (DF)
21:53:30.4294488432 50.144.16.71.1039 > 10.221.22.52.ftp-data: . 128437:129897(1460) ack 1 win 65535 (DF)
21:53:30.4294488467 50.144.16.71.1039 > 10.221.22.52.ftp-data: P 129897:131073(1176) ack 1 win 65535 (DF)
21:53:30.4294494329 10.221.22.52.ftp-data > 50.144.16.71.1039: . ack 126977 win 57344 (DF) [tos 0x8] 
21:53:30.4294494979 50.144.16.71.1039 > 10.221.22.52.ftp-data: . 131073:132533(1460) ack 1 win 65535 (DF)
21:53:30.4294495034 50.144.16.71.1039 > 10.221.22.52.ftp-data: . 132533:133993(1460) ack 1 win 65535 (DF)
21:53:30.4294495069 50.144.16.71.1039 > 10.221.22.52.ftp-data: P 133993:135169(1176) ack 1 win 65535 (DF)
21:53:30.4294495115 50.144.16.71.1039 > 10.221.22.52.ftp-data: . 135169:136629(1460) ack 1 win 65535 (DF)
21:53:30.4294495160 50.144.16.71.1039 > 10.221.22.52.ftp-data: . 136629:138089(1460) ack 1 win 65535 (DF)
21:53:30.4294495195 50.144.16.71.1039 > 10.221.22.52.ftp-data: P 138089:139265(1176) ack 1 win 65535 (DF)
21:53:30.4294501087 10.221.22.52.ftp-data > 50.144.16.71.1039: . ack 135169 win 57344 (DF) [tos 0x8] 
21:53:30.4294501769 50.144.16.71.1039 > 10.221.22.52.ftp-data: . 139265:140725(1460) ack 1 win 65535 (DF)
21:53:30.4294501822 50.144.16.71.1039 > 10.221.22.52.ftp-data: . 140725:142185(1460) ack 1 win 65535 (DF)
21:53:30.4294501857 50.144.16.71.1039 > 10.221.22.52.ftp-data: P 142185:143361(1176) ack 1 win 65535 (DF)
21:53:30.4294501900 50.144.16.71.1039 > 10.221.22.52.ftp-data: . 143361:144821(1460) ack 1 win 65535 (DF)
21:53:30.4294501943 50.144.16.71.1039 > 10.221.22.52.ftp-data: . 144821:146281(1460) ack 1 win 65535 (DF)
21:53:30.4294501978 50.144.16.71.1039 > 10.221.22.52.ftp-data: P 146281:147457(1176) ack 1 win 65535 (DF)
21:53:30.4294507903 10.221.22.52.ftp-data > 50.144.16.71.1039: . ack 143361 win 57344 (DF) [tos 0x8] 
21:53:30.4294508622 50.144.16.71.1039 > 10.221.22.52.ftp-data: . 147457:148917(1460) ack 1 win 65535 (DF)
21:53:30.4294508690 50.144.16.71.1039 > 10.221.22.52.ftp-data: . 148917:150377(1460) ack 1 win 65535 (DF)
21:53:30.4294508725 50.144.16.71.1039 > 10.221.22.52.ftp-data: P 150377:151553(1176) ack 1 win 65535 (DF)
21:53:30.4294508778 50.144.16.71.1039 > 10.221.22.52.ftp-data: . 151553:153013(1460) ack 1 win 65535 (DF)
21:53:30.4294508821 50.144.16.71.1039 > 10.221.22.52.ftp-data: . 153013:154473(1460) ack 1 win 65535 (DF)
21:53:30.4294508856 50.144.16.71.1039 > 10.221.22.52.ftp-data: P 154473:155649(1176) ack 1 win 65535 (DF)
21:53:30.4294514801 10.221.22.52.ftp-data > 50.144.16.71.1039: . ack 151553 win 57344 (DF) [tos 0x8] 
21:53:30.4294515449 50.144.16.71.1039 > 10.221.22.52.ftp-data: . 155649:157109(1460) ack 1 win 65535 (DF)
21:53:30.4294515504 50.144.16.71.1039 > 10.221.22.52.ftp-data: . 157109:158569(1460) ack 1 win 65535 (DF)
21:53:30.4294515539 50.144.16.71.1039 > 10.221.22.52.ftp-data: P 158569:159745(1176) ack 1 win 65535 (DF)
21:53:30.4294515584 50.144.16.71.1039 > 10.221.22.52.ftp-data: . 159745:161205(1460) ack 1 win 65535 (DF)
21:53:30.4294515627 50.144.16.71.1039 > 10.221.22.52.ftp-data: . 161205:162665(1460) ack 1 win 65535 (DF)
21:53:30.4294515662 50.144.16.71.1039 > 10.221.22.52.ftp-data: P 162665:163841(1176) ack 1 win 65535 (DF)
21:53:30.4294521762 10.221.22.52.ftp-data > 50.144.16.71.1039: . ack 159745 win 57344 (DF) [tos 0x8] 
21:53:30.4294522409 50.144.16.71.1039 > 10.221.22.52.ftp-data: . 163841:165301(1460) ack 1 win 65535 (DF)
21:53:30.4294522465 50.144.16.71.1039 > 10.221.22.52.ftp-data: . 165301:166761(1460) ack 1 win 65535 (DF)
21:53:30.4294522500 50.144.16.71.1039 > 10.221.22.52.ftp-data: P 166761:167937(1176) ack 1 win 65535 (DF)
21:53:30.4294522544 50.144.16.71.1039 > 10.221.22.52.ftp-data: . 167937:169397(1460) ack 1 win 65535 (DF)
21:53:30.4294522586 50.144.16.71.1039 > 10.221.22.52.ftp-data: . 169397:170857(1460) ack 1 win 65535 (DF)
21:53:30.4294522621 50.144.16.71.1039 > 10.221.22.52.ftp-data: P 170857:172033(1176) ack 1 win 65535 (DF)
21:53:30.4294528665 10.221.22.52.ftp-data > 50.144.16.71.1039: . ack 167937 win 57344 (DF) [tos 0x8] 
21:53:30.4294529292 50.144.16.71.1039 > 10.221.22.52.ftp-data: . 172033:173493(1460) ack 1 win 65535 (DF)
21:53:30.4294529347 50.144.16.71.1039 > 10.221.22.52.ftp-data: . 173493:174953(1460) ack 1 win 65535 (DF)
21:53:30.4294529382 50.144.16.71.1039 > 10.221.22.52.ftp-data: P 174953:176129(1176) ack 1 win 65535 (DF)
21:53:30.4294529425 50.144.16.71.1039 > 10.221.22.52.ftp-data: . 176129:177589(1460) ack 1 win 65535 (DF)
21:53:30.4294529471 50.144.16.71.1039 > 10.221.22.52.ftp-data: . 177589:179049(1460) ack 1 win 65535 (DF)
21:53:30.4294529506 50.144.16.71.1039 > 10.221.22.52.ftp-data: P 179049:180225(1176) ack 1 win 65535 (DF)
21:53:30.4294536247 10.221.22.52.ftp-data > 50.144.16.71.1039: . ack 176129 win 57344 (DF) [tos 0x8] 
21:53:30.4294536934 50.144.16.71.1039 > 10.221.22.52.ftp-data: . 180225:181685(1460) ack 1 win 65535 (DF)
21:53:30.4294536988 50.144.16.71.1039 > 10.221.22.52.ftp-data: . 181685:183145(1460) ack 1 win 65535 (DF)
21:53:30.4294537023 50.144.16.71.1039 > 10.221.22.52.ftp-data: P 183145:184321(1176) ack 1 win 65535 (DF)
21:53:30.4294537066 50.144.16.71.1039 > 10.221.22.52.ftp-data: . 184321:185781(1460) ack 1 win 65535 (DF)
21:53:30.4294537109 50.144.16.71.1039 > 10.221.22.52.ftp-data: . 185781:187241(1460) ack 1 win 65535 (DF)
21:53:30.4294537144 50.144.16.71.1039 > 10.221.22.52.ftp-data: P 187241:188417(1176) ack 1 win 65535 (DF)
21:53:30.4294543309 10.221.22.52.ftp-data > 50.144.16.71.1039: . ack 184321 win 57344 (DF) [tos 0x8] 
21:53:30.4294544001 50.144.16.71.1039 > 10.221.22.52.ftp-data: . 188417:189877(1460) ack 1 win 65535 (DF)
21:53:30.4294544045 50.144.16.71.1039 > 10.221.22.52.ftp-data: . 189877:191337(1460) ack 1 win 65535 (DF)
21:53:30.4294544080 50.144.16.71.1039 > 10.221.22.52.ftp-data: P 191337:192513(1176) ack 1 win 65535 (DF)
21:53:30.4294544133 50.144.16.71.1039 > 10.221.22.52.ftp-data: . 192513:193973(1460) ack 1 win 65535 (DF)
21:53:30.4294544176 50.144.16.71.1039 > 10.221.22.52.ftp-data: . 193973:195433(1460) ack 1 win 65535 (DF)
21:53:30.4294544211 50.144.16.71.1039 > 10.221.22.52.ftp-data: P 195433:196609(1176) ack 1 win 65535 (DF)
21:53:30.4294550126 10.221.22.52.ftp-data > 50.144.16.71.1039: . ack 192513 win 57344 (DF) [tos 0x8] 
21:53:30.4294550770 50.144.16.71.1039 > 10.221.22.52.ftp-data: . 196609:198069(1460) ack 1 win 65535 (DF)
21:53:30.4294550826 50.144.16.71.1039 > 10.221.22.52.ftp-data: . 198069:199529(1460) ack 1 win 65535 (DF)
21:53:30.4294550861 50.144.16.71.1039 > 10.221.22.52.ftp-data: P 199529:200705(1176) ack 1 win 65535 (DF)
21:53:30.4294550904 50.144.16.71.1039 > 10.221.22.52.ftp-data: . 200705:202165(1460) ack 1 win 65535 (DF)
21:53:30.4294550947 50.144.16.71.1039 > 10.221.22.52.ftp-data: . 202165:203625(1460) ack 1 win 65535 (DF)
21:53:30.4294550982 50.144.16.71.1039 > 10.221.22.52.ftp-data: P 203625:204801(1176) ack 1 win 65535 (DF)
21:53:30.4294557814 10.221.22.52.ftp-data > 50.144.16.71.1039: . ack 200705 win 57344 (DF) [tos 0x8] 
21:53:30.4294558710 50.144.16.71.1039 > 10.221.22.52.ftp-data: . 204801:206261(1460) ack 1 win 65535 (DF)
21:53:30.4294558754 50.144.16.71.1039 > 10.221.22.52.ftp-data: . 206261:207721(1460) ack 1 win 65535 (DF)
21:53:30.4294558788 50.144.16.71.1039 > 10.221.22.52.ftp-data: P 207721:208897(1176) ack 1 win 65535 (DF)
21:53:30.4294558834 50.144.16.71.1039 > 10.221.22.52.ftp-data: . 208897:210357(1460) ack 1 win 65535 (DF)
21:53:30.4294558877 50.144.16.71.1039 > 10.221.22.52.ftp-data: . 210357:211817(1460) ack 1 win 65535 (DF)
21:53:30.4294558912 50.144.16.71.1039 > 10.221.22.52.ftp-data: P 211817:212993(1176) ack 1 win 65535 (DF)
21:53:30.4294564829 10.221.22.52.ftp-data > 50.144.16.71.1039: . ack 208897 win 57344 (DF) [tos 0x8] 
21:53:30.4294565464 50.144.16.71.1039 > 10.221.22.52.ftp-data: . 212993:214453(1460) ack 1 win 65535 (DF)
21:53:30.4294565507 50.144.16.71.1039 > 10.221.22.52.ftp-data: . 214453:215913(1460) ack 1 win 65535 (DF)
21:53:30.4294565542 50.144.16.71.1039 > 10.221.22.52.ftp-data: P 215913:217089(1176) ack 1 win 65535 (DF)
21:53:30.4294565588 50.144.16.71.1039 > 10.221.22.52.ftp-data: . 217089:218549(1460) ack 1 win 65535 (DF)
21:53:30.4294565631 50.144.16.71.1039 > 10.221.22.52.ftp-data: . 218549:220009(1460) ack 1 win 65535 (DF)
21:53:30.4294565666 50.144.16.71.1039 > 10.221.22.52.ftp-data: P 220009:221185(1176) ack 1 win 65535 (DF)
21:53:30.4294571580 10.221.22.52.ftp-data > 50.144.16.71.1039: . ack 217089 win 57344 (DF) [tos 0x8] 
21:53:30.4294572269 50.144.16.71.1039 > 10.221.22.52.ftp-data: . 221185:222645(1460) ack 1 win 65535 (DF)
21:53:30.4294572313 50.144.16.71.1039 > 10.221.22.52.ftp-data: . 222645:224105(1460) ack 1 win 65535 (DF)
21:53:30.4294572347 50.144.16.71.1039 > 10.221.22.52.ftp-data: P 224105:225281(1176) ack 1 win 65535 (DF)
21:53:30.4294572390 50.144.16.71.1039 > 10.221.22.52.ftp-data: . 225281:226741(1460) ack 1 win 65535 (DF)
21:53:30.4294572433 50.144.16.71.1039 > 10.221.22.52.ftp-data: . 226741:228201(1460) ack 1 win 65535 (DF)
21:53:30.4294572468 50.144.16.71.1039 > 10.221.22.52.ftp-data: P 228201:229377(1176) ack 1 win 65535 (DF)
21:53:30.4294578545 10.221.22.52.ftp-data > 50.144.16.71.1039: . ack 225281 win 57344 (DF) [tos 0x8] 
21:53:30.4294579259 50.144.16.71.1039 > 10.221.22.52.ftp-data: . 229377:230837(1460) ack 1 win 65535 (DF)
21:53:30.4294579302 50.144.16.71.1039 > 10.221.22.52.ftp-data: . 230837:232297(1460) ack 1 win 65535 (DF)
21:53:30.4294579359 50.144.16.71.1039 > 10.221.22.52.ftp-data: P 232297:233473(1176) ack 1 win 65535 (DF)
21:53:30.4294579410 50.144.16.71.1039 > 10.221.22.52.ftp-data: . 233473:234933(1460) ack 1 win 65535 (DF)
21:53:30.4294579456 50.144.16.71.1039 > 10.221.22.52.ftp-data: . 234933:236393(1460) ack 1 win 65535 (DF)
21:53:30.4294579491 50.144.16.71.1039 > 10.221.22.52.ftp-data: P 236393:237569(1176) ack 1 win 65535 (DF)
21:53:30.4294585411 10.221.22.52.ftp-data > 50.144.16.71.1039: . ack 233473 win 57344 (DF) [tos 0x8] 
21:53:30.4294586092 50.144.16.71.1039 > 10.221.22.52.ftp-data: . 237569:239029(1460) ack 1 win 65535 (DF)
21:53:30.4294586148 50.144.16.71.1039 > 10.221.22.52.ftp-data: . 239029:240489(1460) ack 1 win 65535 (DF)
21:53:30.4294586183 50.144.16.71.1039 > 10.221.22.52.ftp-data: P 240489:241665(1176) ack 1 win 65535 (DF)
21:53:30.4294586226 50.144.16.71.1039 > 10.221.22.52.ftp-data: . 241665:243125(1460) ack 1 win 65535 (DF)
21:53:30.4294586269 50.144.16.71.1039 > 10.221.22.52.ftp-data: . 243125:244585(1460) ack 1 win 65535 (DF)
21:53:30.4294586304 50.144.16.71.1039 > 10.221.22.52.ftp-data: P 244585:245761(1176) ack 1 win 65535 (DF)
21:53:30.4294592234 10.221.22.52.ftp-data > 50.144.16.71.1039: . ack 241665 win 57344 (DF) [tos 0x8] 
21:53:30.4294592903 50.144.16.71.1039 > 10.221.22.52.ftp-data: . 245761:247221(1460) ack 1 win 65535 (DF)
21:53:30.4294592946 50.144.16.71.1039 > 10.221.22.52.ftp-data: . 247221:248681(1460) ack 1 win 65535 (DF)
21:53:30.4294592983 50.144.16.71.1039 > 10.221.22.52.ftp-data: P 248681:249857(1176) ack 1 win 65535 (DF)
21:53:30.4294593026 50.144.16.71.1039 > 10.221.22.52.ftp-data: . 249857:251317(1460) ack 1 win 65535 (DF)
21:53:30.4294593072 50.144.16.71.1039 > 10.221.22.52.ftp-data: . 251317:252777(1460) ack 1 win 65535 (DF)
21:53:30.4294593107 50.144.16.71.1039 > 10.221.22.52.ftp-data: P 252777:253953(1176) ack 1 win 65535 (DF)
21:53:30.4294599042 10.221.22.52.ftp-data > 50.144.16.71.1039: . ack 249857 win 57344 (DF) [tos 0x8] 
21:53:30.4294599688 50.144.16.71.1039 > 10.221.22.52.ftp-data: . 253953:255413(1460) ack 1 win 65535 (DF)
21:53:30.4294599731 50.144.16.71.1039 > 10.221.22.52.ftp-data: . 255413:256873(1460) ack 1 win 65535 (DF)
21:53:30.4294599766 50.144.16.71.1039 > 10.221.22.52.ftp-data: P 256873:258049(1176) ack 1 win 65535 (DF)
21:53:30.4294599809 50.144.16.71.1039 > 10.221.22.52.ftp-data: . 258049:259509(1460) ack 1 win 65535 (DF)
21:53:30.4294599852 50.144.16.71.1039 > 10.221.22.52.ftp-data: . 259509:260969(1460) ack 1 win 65535 (DF)
21:53:30.4294599887 50.144.16.71.1039 > 10.221.22.52.ftp-data: P 260969:262145(1176) ack 1 win 65535 (DF)
21:53:30.4294605836 10.221.22.52.ftp-data > 50.144.16.71.1039: . ack 258049 win 57344 (DF) [tos 0x8] 
21:53:30.4294606478 50.144.16.71.1039 > 10.221.22.52.ftp-data: . 262145:263605(1460) ack 1 win 65535 (DF)
21:53:30.4294606531 50.144.16.71.1039 > 10.221.22.52.ftp-data: . 263605:265065(1460) ack 1 win 65535 (DF)
21:53:30.4294606609 50.144.16.71.1039 > 10.221.22.52.ftp-data: P 265065:266241(1176) ack 1 win 65535 (DF)
21:53:30.4294606652 50.144.16.71.1039 > 10.221.22.52.ftp-data: . 266241:267701(1460) ack 1 win 65535 (DF)
21:53:30.4294606738 50.144.16.71.1039 > 10.221.22.52.ftp-data: . 267701:269161(1460) ack 1 win 65535 (DF)
21:53:30.4294606818 50.144.16.71.1039 > 10.221.22.52.ftp-data: P 269161:270337(1176) ack 1 win 65535 (DF)
21:53:30.4294612644 10.221.22.52.ftp-data > 50.144.16.71.1039: . ack 266241 win 57344 (DF) [tos 0x8] 
21:53:30.4294613285 50.144.16.71.1039 > 10.221.22.52.ftp-data: . 270337:271797(1460) ack 1 win 65535 (DF)
21:53:30.4294613328 50.144.16.71.1039 > 10.221.22.52.ftp-data: . 271797:273257(1460) ack 1 win 65535 (DF)
21:53:30.4294613363 50.144.16.71.1039 > 10.221.22.52.ftp-data: P 273257:274433(1176) ack 1 win 65535 (DF)
21:53:30.4294613405 50.144.16.71.1039 > 10.221.22.52.ftp-data: . 274433:275893(1460) ack 1 win 65535 (DF)
21:53:30.4294613492 50.144.16.71.1039 > 10.221.22.52.ftp-data: . 275893:277353(1460) ack 1 win 65535 (DF)
21:53:30.4294613547 50.144.16.71.1039 > 10.221.22.52.ftp-data: P 277353:278529(1176) ack 1 win 65535 (DF)
21:53:30.4294619409 10.221.22.52.ftp-data > 50.144.16.71.1039: . ack 274433 win 57344 (DF) [tos 0x8] 
21:53:30.4294620055 50.144.16.71.1039 > 10.221.22.52.ftp-data: . 278529:279989(1460) ack 1 win 65535 (DF)
21:53:30.4294620112 50.144.16.71.1039 > 10.221.22.52.ftp-data: . 279989:281449(1460) ack 1 win 65535 (DF)
21:53:30.4294620150 50.144.16.71.1039 > 10.221.22.52.ftp-data: P 281449:282625(1176) ack 1 win 65535 (DF)
21:53:30.4294620235 50.144.16.71.1039 > 10.221.22.52.ftp-data: . 282625:284085(1460) ack 1 win 65535 (DF)
21:53:30.4294620299 50.144.16.71.1039 > 10.221.22.52.ftp-data: . 284085:285545(1460) ack 1 win 65535 (DF)
21:53:30.4294620337 50.144.16.71.1039 > 10.221.22.52.ftp-data: P 285545:286721(1176) ack 1 win 65535 (DF)
21:53:30.4294626994 10.221.22.52.ftp-data > 50.144.16.71.1039: . ack 282625 win 57344 (DF) [tos 0x8] 
21:53:30.4294627636 50.144.16.71.1039 > 10.221.22.52.ftp-data: . 286721:288181(1460) ack 1 win 65535 (DF)
21:53:30.4294627679 50.144.16.71.1039 > 10.221.22.52.ftp-data: . 288181:289641(1460) ack 1 win 65535 (DF)
21:53:30.4294627714 50.144.16.71.1039 > 10.221.22.52.ftp-data: P 289641:290817(1176) ack 1 win 65535 (DF)
21:53:30.4294627757 50.144.16.71.1039 > 10.221.22.52.ftp-data: . 290817:292277(1460) ack 1 win 65535 (DF)
21:53:30.4294627800 50.144.16.71.1039 > 10.221.22.52.ftp-data: . 292277:293737(1460) ack 1 win 65535 (DF)
21:53:30.4294627835 50.144.16.71.1039 > 10.221.22.52.ftp-data: P 293737:294913(1176) ack 1 win 65535 (DF)
21:53:30.4294633813 10.221.22.52.ftp-data > 50.144.16.71.1039: . ack 290817 win 57344 (DF) [tos 0x8] 
21:53:30.4294634489 50.144.16.71.1039 > 10.221.22.52.ftp-data: . 294913:296373(1460) ack 1 win 65535 (DF)
21:53:30.4294634565 50.144.16.71.1039 > 10.221.22.52.ftp-data: . 296373:297833(1460) ack 1 win 65535 (DF)
21:53:30.4294634600 50.144.16.71.1039 > 10.221.22.52.ftp-data: P 297833:299009(1176) ack 1 win 65535 (DF)
21:53:30.4294634643 50.144.16.71.1039 > 10.221.22.52.ftp-data: . 299009:300469(1460) ack 1 win 65535 (DF)
21:53:30.4294634686 50.144.16.71.1039 > 10.221.22.52.ftp-data: . 300469:301929(1460) ack 1 win 65535 (DF)
21:53:30.4294634721 50.144.16.71.1039 > 10.221.22.52.ftp-data: P 301929:303105(1176) ack 1 win 65535 (DF)
21:53:30.4294640830 10.221.22.52.ftp-data > 50.144.16.71.1039: . ack 299009 win 57344 (DF) [tos 0x8] 
21:53:30.4294641649 50.144.16.71.1039 > 10.221.22.52.ftp-data: . 303105:304565(1460) ack 1 win 65535 (DF)
21:53:30.4294641692 50.144.16.71.1039 > 10.221.22.52.ftp-data: . 304565:306025(1460) ack 1 win 65535 (DF)
21:53:30.4294641730 50.144.16.71.1039 > 10.221.22.52.ftp-data: P 306025:307201(1176) ack 1 win 65535 (DF)
21:53:30.4294641773 50.144.16.71.1039 > 10.221.22.52.ftp-data: . 307201:308661(1460) ack 1 win 65535 (DF)
21:53:30.4294641816 50.144.16.71.1039 > 10.221.22.52.ftp-data: . 308661:310121(1460) ack 1 win 65535 (DF)
21:53:30.4294641851 50.144.16.71.1039 > 10.221.22.52.ftp-data: P 310121:311297(1176) ack 1 win 65535 (DF)
21:53:30.4294648630 10.221.22.52.ftp-data > 50.144.16.71.1039: . ack 307201 win 57344 (DF) [tos 0x8] 
21:53:30.4294649277 50.144.16.71.1039 > 10.221.22.52.ftp-data: . 311297:312757(1460) ack 1 win 65535 (DF)
21:53:30.4294649331 50.144.16.71.1039 > 10.221.22.52.ftp-data: . 312757:314217(1460) ack 1 win 65535 (DF)
21:53:30.4294649367 50.144.16.71.1039 > 10.221.22.52.ftp-data: P 314217:315393(1176) ack 1 win 65535 (DF)
21:53:30.4294649413 50.144.16.71.1039 > 10.221.22.52.ftp-data: . 315393:316853(1460) ack 1 win 65535 (DF)
21:53:30.4294649501 50.144.16.71.1039 > 10.221.22.52.ftp-data: . 316853:318313(1460) ack 1 win 65535 (DF)
21:53:30.4294649562 50.144.16.71.1039 > 10.221.22.52.ftp-data: P 318313:319489(1176) ack 1 win 65535 (DF)
21:53:30.4294655816 10.221.22.52.ftp-data > 50.144.16.71.1039: . ack 315393 win 57344 (DF) [tos 0x8] 
21:53:30.4294656514 50.144.16.71.1039 > 10.221.22.52.ftp-data: . 319489:320949(1460) ack 1 win 65535 (DF)
21:53:30.4294656575 50.144.16.71.1039 > 10.221.22.52.ftp-data: . 320949:322409(1460) ack 1 win 65535 (DF)
21:53:30.4294656610 50.144.16.71.1039 > 10.221.22.52.ftp-data: P 322409:323585(1176) ack 1 win 65535 (DF)
21:53:30.4294656653 50.144.16.71.1039 > 10.221.22.52.ftp-data: . 323585:325045(1460) ack 1 win 65535 (DF)
21:53:30.4294656697 50.144.16.71.1039 > 10.221.22.52.ftp-data: . 325045:326505(1460) ack 1 win 65535 (DF)
21:53:30.4294656732 50.144.16.71.1039 > 10.221.22.52.ftp-data: P 326505:327681(1176) ack 1 win 65535 (DF)
21:53:30.4294663188 10.221.22.52.ftp-data > 50.144.16.71.1039: . ack 323585 win 57344 (DF) [tos 0x8] 
21:53:30.4294663812 50.144.16.71.1039 > 10.221.22.52.ftp-data: . 327681:329141(1460) ack 1 win 65535 (DF)
21:53:30.4294663867 50.144.16.71.1039 > 10.221.22.52.ftp-data: . 329141:330601(1460) ack 1 win 65535 (DF)
21:53:30.4294663902 50.144.16.71.1039 > 10.221.22.52.ftp-data: P 330601:331777(1176) ack 1 win 65535 (DF)
21:53:30.4294663945 50.144.16.71.1039 > 10.221.22.52.ftp-data: . 331777:333237(1460) ack 1 win 65535 (DF)
21:53:30.4294663988 50.144.16.71.1039 > 10.221.22.52.ftp-data: . 333237:334697(1460) ack 1 win 65535 (DF)
21:53:30.4294664023 50.144.16.71.1039 > 10.221.22.52.ftp-data: P 334697:335873(1176) ack 1 win 65535 (DF)
21:53:30.4294669921 10.221.22.52.ftp-data > 50.144.16.71.1039: . ack 331777 win 57344 (DF) [tos 0x8] 
21:53:30.4294670609 50.144.16.71.1039 > 10.221.22.52.ftp-data: . 335873:337333(1460) ack 1 win 65535 (DF)
